{
  "ir_version": 3,
  "chunk_id": "inference-random-restarts-inventory-gold",
  "files": [
    "sections/appendix-dynamics.tex",
    "sections/appendix-prevalence.tex",
    "sections/appendix-bayes.tex",
    "sections/appendix-application.tex"
  ],
  "nodes": [
    {
      "local_id": "n1",
      "statement_location": [
        0,
        43,
        50
      ],
      "provenance": "explicit",
      "type_hint": "external-result",
      "summary": "Nagurney projected-system theorem gives global solutions and continuous dependence under one-sided Lipschitz and linear-growth conditions.",
      "visible_title": "Nagurney projected-system well-posedness theorem",
      "external_identity": {
        "name": "Nagurney projected-system well-posedness theorem",
        "citation_key": "nagurney2012projected",
        "theorem": "2.5"
      }
    },
    {
      "local_id": "n2",
      "statement_location": [
        0,
        34,
        41
      ],
      "provenance": "explicit",
      "type_hint": "result",
      "summary": "A globally Lipschitz vector field on X admits a unique continuous global projected flow.",
      "environment": "lemma",
      "labels": [
        "lemma:global-lip-flow"
      ],
      "visible_title": "Global well-posedness under global Lipschitzness"
    },
    {
      "local_id": "n3",
      "statement_location": [
        0,
        77,
        86
      ],
      "provenance": "explicit",
      "type_hint": "external-result",
      "summary": "Coordinatewise McShane extension extends the locally Lipschitz restriction on K_R to a globally Lipschitz map.",
      "visible_title": "McShane extension theorem",
      "external_identity": {
        "name": "McShane extension theorem"
      }
    },
    {
      "local_id": "n4",
      "statement_location": [
        0,
        69,
        75
      ],
      "provenance": "explicit",
      "type_hint": "result",
      "summary": "For locally Lipschitz Q, each bounded region has a globally Lipschitz extension agreeing with Q and a continuous global projected flow.",
      "environment": "lemma",
      "labels": [
        "lemma:localized-global-systems"
      ],
      "visible_title": "Lipschitz extensions on bounded regions"
    },
    {
      "local_id": "n5",
      "statement_location": [
        0,
        89,
        99
      ],
      "provenance": "explicit",
      "type_hint": "setup",
      "summary": "Fixes localized flows and defines the first exit time sigma_{K_R}(x) from the localization ball.",
      "visible_title": "Localization exit times"
    },
    {
      "local_id": "n6",
      "statement_location": [
        0,
        107,
        117
      ],
      "provenance": "explicit",
      "type_hint": "result",
      "summary": "Before the smaller localization exits, it solves the original projected dynamics and agrees with larger localizations.",
      "environment": "lemma",
      "labels": [
        "lemma:localized-consistency"
      ],
      "visible_title": "Agreement before exit"
    },
    {
      "local_id": "n7",
      "statement_location": [
        0,
        146,
        162
      ],
      "provenance": "explicit",
      "type_hint": "result",
      "summary": "The supremum of localized exit times defines a positive-lifetime local flow solving the original projected dynamics.",
      "environment": "lemma",
      "labels": [
        "lemma:local-flow-construction"
      ],
      "visible_title": "Constructing the maximal local flow"
    },
    {
      "local_id": "n8",
      "statement_location": [
        0,
        179,
        184
      ],
      "provenance": "explicit",
      "type_hint": "result",
      "summary": "The patched lifetime is maximal and every local solution agrees with the unique maximal local solution map.",
      "environment": "lemma",
      "labels": [
        "lemma:maximal-local-flow"
      ],
      "visible_title": "Maximality and uniqueness"
    },
    {
      "local_id": "n9",
      "statement_location": [
        0,
        210,
        214
      ],
      "provenance": "explicit",
      "type_hint": "result",
      "summary": "The maximal lifetime is lower semicontinuous and the local flow is continuous on its domain.",
      "environment": "lemma",
      "labels": [
        "lemma:lsc-flow-continuity"
      ],
      "visible_title": "Regularity of tau and G"
    },
    {
      "local_id": "n10",
      "statement_location": [
        0,
        241,
        241
      ],
      "provenance": "explicit",
      "type_hint": "result",
      "summary": "If X is closed and convex and Q is locally Lipschitz, the projected dynamics are well behaved; under global Lipschitzness the maximal flow is global.",
      "environment": "lemma",
      "labels": [
        "lemma:Lipschitz"
      ],
      "visible_title": "Local Lipschitzness implies well-behaved projected dynamics"
    },
    {
      "local_id": "n11",
      "statement_location": [
        0,
        255,
        255
      ],
      "provenance": "explicit",
      "type_hint": "result",
      "summary": "Every dynamic solver g_Q is measurable from X to X disjoint union {dagger}.",
      "environment": "proposition",
      "labels": [
        "prop:measurable"
      ],
      "visible_title": "Dynamic solvers are measurable"
    },
    {
      "local_id": "n17",
      "statement_location": [
        0,
        395,
        410
      ],
      "provenance": "explicit",
      "type_hint": "external-result",
      "summary": "Dominated convergence, equivalently Cesaro averaging, identifies the long-run time average with the limit value.",
      "visible_title": "Dominated convergence / Cesaro averaging",
      "external_identity": {
        "name": "Dominated convergence / Cesaro averaging"
      }
    },
    {
      "local_id": "n18",
      "statement_location": [
        0,
        337,
        342
      ],
      "provenance": "explicit",
      "type_hint": "result",
      "summary": "Every ordinary dynamic-solver outcome is a root of the projected vector field, while nonconvergent outcomes are dagger.",
      "environment": "lemma",
      "labels": [
        "lemma:containment"
      ],
      "visible_title": "Terminal outcomes lie among projected roots"
    },
    {
      "local_id": "n19",
      "statement_location": [
        1,
        43,
        44
      ],
      "provenance": "explicit",
      "type_hint": "result",
      "summary": "A dynamic solver has finitely many reachable terminal outcomes exactly when its projected vector field has finitely many roots.",
      "environment": "proposition",
      "labels": [
        "prop:finite-rto-roots"
      ],
      "visible_title": "Finite reachable outcomes exactly when projected roots are finite"
    },
    {
      "local_id": "n20",
      "statement_location": [
        1,
        259,
        259
      ],
      "provenance": "explicit",
      "type_hint": "result",
      "summary": "Under convexity, root compactness, and submersion-probe hypotheses, prevalent dynamics have finitely many reachable terminal outcomes.",
      "environment": "proposition",
      "labels": [
        "prop:e-submersion-finite-attractors"
      ],
      "visible_title": "Submersion probes imply prevalent finiteness of reachable terminal outcomes"
    },
    {
      "local_id": "n21",
      "statement_location": [
        1,
        55,
        63
      ],
      "provenance": "explicit",
      "type_hint": "assumption",
      "summary": "The projected-root set lies in a common compact set, and the state space has the required C2 boundary regularity.",
      "labels": [
        "ass:kkq"
      ],
      "visible_title": "Root compactness",
      "kind_hint": "standing"
    },
    {
      "local_id": "n22",
      "statement_location": [
        1,
        239,
        243
      ],
      "provenance": "explicit",
      "type_hint": "assumption",
      "summary": "The state space X is closed and convex.",
      "labels": [
        "ass:convex-closed"
      ],
      "visible_title": "Closed convex state space",
      "kind_hint": "standing"
    },
    {
      "local_id": "n23",
      "statement_location": [
        1,
        11,
        26
      ],
      "provenance": "explicit",
      "type_hint": "exposition",
      "summary": "For C2 boundary, QTC equals Q in the interior and QTCP on the boundary, with QTCP using the positive normal component.",
      "environment": "remark",
      "visible_title": "Interior and boundary projection formula"
    },
    {
      "local_id": "n24",
      "statement_location": [
        1,
        30,
        34
      ],
      "provenance": "explicit",
      "type_hint": "result",
      "summary": "A subset closed and discrete in a topological space is finite when contained in a compact set.",
      "environment": "lemma",
      "labels": [
        "lemma:closed-discrete-finite"
      ],
      "visible_title": "Closed discrete sets in compact sets are finite"
    },
    {
      "local_id": "n25",
      "statement_location": [
        1,
        48,
        51
      ],
      "provenance": "explicit",
      "type_hint": "result",
      "summary": "Projected-field roots are contained in roots of Q or QTCP, and those two root sets are closed in their domains.",
      "environment": "lemma",
      "labels": [
        "lemma:break-into-two"
      ],
      "visible_title": "Projected roots split into interior and boundary roots"
    },
    {
      "local_id": "n26",
      "statement_location": [
        1,
        70,
        77
      ],
      "provenance": "explicit",
      "type_hint": "setup",
      "summary": "The boundary roots are encoded by the C1 map tilde Q(x,alpha)=Q(x)-alpha n(x).",
      "visible_title": "Boundary-root encoding"
    },
    {
      "local_id": "n27",
      "statement_location": [
        1,
        80,
        82
      ],
      "provenance": "explicit",
      "type_hint": "result",